mysql> show databases;
+---------------------------+
| Database                  |
+---------------------------+
| ecomerce                  |
| ecommerce                 |
| information_schema        |
| mysql                     |
| performance_schema        |
| sakila                    |
| student_management_system |
| sys                       |
| world                     |
+---------------------------+
9 rows in set (0.03 sec)

mysql> use ecommerce
Database changed
mysql> show tables;
+---------------------+
| Tables_in_ecommerce |
+---------------------+
| customer            |
| orders              |
| product             |
+---------------------+
3 rows in set (0.02 sec)

mysql> desc customer;
+-------------+--------------+------+-----+---------+-------+
| Field       | Type         | Null | Key | Default | Extra |
+-------------+--------------+------+-----+---------+-------+
| customer_id | varchar(5)   | NO   | PRI | NULL    |       |
| name        | varchar(10)  | NO   |     | NULL    |       |
| city        | varchar(10)  | NO   |     | NULL    |       |
| email       | varchar(20)  | NO   |     | NULL    |       |
| address     | varchar(100) | NO   |     | NULL    |       |
| phone_no    | varchar(10)  | NO   |     | NULL    |       |
| pin_code    | int          | NO   |     | NULL    |       |
+-------------+--------------+------+-----+---------+-------+
7 rows in set (0.02 sec)

mysql> select * from customer;
Empty set (0.01 sec)


Q) Using command insert for inserting values:

mysql> insert into customer(customer_id, name, city, email, address, phone_no, pin_code) values('c-101', 'pranavpawr', 'raigad', 'pranav27@gmail.com', 'raigad fort, fauji ambavade', '8862020733', '421301');
Query OK, 1 row affected (0.02 sec)

mysql> select * from customer;
+-------------+------------+--------+--------------------+-----------------------------+------------+----------+
| customer_id | name       | city   | email              | address                     | phone_no   | pin_code |
+-------------+------------+--------+--------------------+-----------------------------+------------+----------+
| c-101       | pranavpawr | raigad | pranav27@gmail.com | raigad fort, fauji ambavade | 8862020733 |   421301 |
+-------------+------------+--------+--------------------+-----------------------------+------------+----------+
1 row in set (0.00 sec)

mysql> select customer_id, name from customer;
+-------------+------------+
| customer_id | name       |
+-------------+------------+
| c-101       | pranavpawr |
+-------------+------------+
1 row in set (0.00 sec)

mysql> insert into customer values('c-102', 'pranjal', 'kalyan', 'pranjal12@gmail.com', 'adharwadi jail road', '9420749307', '421301');
Query OK, 1 row affected (0.01 sec)

mysql> select * from customer;
+-------------+------------+--------+---------------------+-----------------------------+------------+----------+
| customer_id | name       | city   | email               | address                     | phone_no   | pin_code |
+-------------+------------+--------+---------------------+-----------------------------+------------+----------+
| c-101       | pranavpawr | raigad | pranav27@gmail.com  | raigad fort, fauji ambavade | 8862020733 |   421301 |
| c-102       | pranjal    | kalyan | pranjal12@gmail.com | adharwadi jail road         | 9420749307 |   421301 |
+-------------+------------+--------+---------------------+-----------------------------+------------+----------+
2 rows in set (0.00 sec)

mysql> insert into customer values('c-103', 'sakshi', 'dhule', 'sakshi04@gail.com', 'agrawal college', '678892', '421301'), ('c-104', 'sanika', 'agss', 'sa@gmail.com', 'ahduuhdeofiijf', '577363726', 421301);
Query OK, 2 rows affected (0.01 sec)
Records: 2  Duplicates: 0  Warnings: 0

mysql> select * from customer;
+-------------+------------+--------+---------------------+-----------------------------+------------+----------+
| customer_id | name       | city   | email               | address                     | phone_no   | pin_code |
+-------------+------------+--------+---------------------+-----------------------------+------------+----------+
| c-101       | pranavpawr | raigad | pranav27@gmail.com  | raigad fort, fauji ambavade | 8862020733 |   421301 |
| c-102       | pranjal    | kalyan | pranjal12@gmail.com | adharwadi jail road         | 9420749307 |   421301 |
| c-103       | sakshi     | dhule  | sakshi04@gail.com   | agrawal college             | 678892     |   421301 |
| c-104       | sanika     | agss   | sa@gmail.com        | ahduuhdeofiijf              | 577363726  |   421301 |
+-------------+------------+--------+---------------------+-----------------------------+------------+----------+
4 rows in set (0.00 sec)


Q) using alter command to modify datatype and records:

mysql> alter table customer modify name varchar(50), modify email varchar(50);
Query OK, 0 rows affected (0.11 sec)
Records: 0  Duplicates: 0  Warnings: 0

mysql> desc customer;
+-------------+--------------+------+-----+---------+-------+
| Field       | Type         | Null | Key | Default | Extra |
+-------------+--------------+------+-----+---------+-------+
| customer_id | varchar(5)   | NO   | PRI | NULL    |       |
| name        | varchar(50)  | YES  |     | NULL    |       |
| city        | varchar(10)  | NO   |     | NULL    |       |
| email       | varchar(50)  | YES  |     | NULL    |       |
| address     | varchar(100) | NO   |     | NULL    |       |
| phone_no    | varchar(10)  | NO   |     | NULL    |       |
| pin_code    | int          | NO   |     | NULL    |       |
+-------------+--------------+------+-----+---------+-------+
7 rows in set (0.00 sec)


Q) using alter command to add new values and rows:

mysql> alter table customer add state varchar(50), add country varchar(20);
Query OK, 0 rows affected (0.03 sec)
Records: 0  Duplicates: 0  Warnings: 0

mysql> desc customer;
+-------------+--------------+------+-----+---------+-------+
| Field       | Type         | Null | Key | Default | Extra |
+-------------+--------------+------+-----+---------+-------+
| customer_id | varchar(5)   | NO   | PRI | NULL    |       |
| name        | varchar(50)  | YES  |     | NULL    |       |
| city        | varchar(10)  | NO   |     | NULL    |       |
| email       | varchar(50)  | YES  |     | NULL    |       |
| address     | varchar(100) | NO   |     | NULL    |       |
| phone_no    | varchar(10)  | NO   |     | NULL    |       |
| pin_code    | int          | NO   |     | NULL    |       |
| state       | varchar(50)  | YES  |     | NULL    |       |
| country     | varchar(20)  | YES  |     | NULL    |       |
+-------------+--------------+------+-----+---------+-------+
9 rows in set (0.00 sec)

Q) USING ALTER COMMAND TO DROP PRIMARY KEY:

mysql> create table demo(demo_id varchar(10) primary key not null);
Query OK, 0 rows affected (0.05 sec)

mysql> desc demo;
+---------+-------------+------+-----+---------+-------+
| Field   | Type        | Null | Key | Default | Extra |
+---------+-------------+------+-----+---------+-------+
| demo_id | varchar(10) | NO   | PRI | NULL    |       |
+---------+-------------+------+-----+---------+-------+
1 row in set (0.00 sec)

mysql> alter table demo drop primary key;
Query OK, 0 rows affected (0.10 sec)
Records: 0  Duplicates: 0  Warnings: 0

mysql> alter table demo add primary key(demo_id);
Query OK, 0 rows affected (0.08 sec)
Records: 0  Duplicates: 0  Warnings: 0

Q) DELETE RECORDS USING WHERE COMMAND:

mysql> select * from customer;
+-------------+------------+--------+---------------------+-----------------------------+------------+----------+-------+---------+
| customer_id | name       | city   | email               | address                     | phone_no   | pin_code | state | country |
+-------------+------------+--------+---------------------+-----------------------------+------------+----------+-------+---------+
| c-101       | pranavpawr | raigad | pranav27@gmail.com  | raigad fort, fauji ambavade | 8862020733 |   421301 | NULL  | NULL    |
| c-102       | pranjal    | kalyan | pranjal12@gmail.com | adharwadi jail road         | 9420749307 |   421301 | NULL  | NULL    |
| c-103       | sakshi     | dhule  | sakshi04@gail.com   | agrawal college             | 678892     |   421301 | NULL  | NULL    |
| c-104       | sanika     | agss   | sa@gmail.com        | ahduuhdeofiijf              | 577363726  |   421301 | NULL  | NULL    |
+-------------+------------+--------+---------------------+-----------------------------+------------+----------+-------+---------+
4 rows in set (0.00 sec)

mysql> delete from customer where customer_id = 'c-103';
Query OK, 1 row affected (0.01 sec)

mysql> select * from customer;
+-------------+------------+--------+---------------------+-----------------------------+------------+----------+-------+---------+
| customer_id | name       | city   | email               | address                     | phone_no   | pin_code | state | country |
+-------------+------------+--------+---------------------+-----------------------------+------------+----------+-------+---------+
| c-101       | pranavpawr | raigad | pranav27@gmail.com  | raigad fort, fauji ambavade | 8862020733 |   421301 | NULL  | NULL    |
| c-102       | pranjal    | kalyan | pranjal12@gmail.com | adharwadi jail road         | 9420749307 |   421301 | NULL  | NULL    |
| c-104       | sanika     | agss   | sa@gmail.com        | ahduuhdeofiijf              | 577363726  |   421301 | NULL  | NULL    |
+-------------+------------+--------+---------------------+-----------------------------+------------+----------+-------+---------+
3 rows in set (0.00 sec)

Q) USING TRUNCATE COMMAND TO REMOVE ROWS WITHOUT REMOVING STRUCTURE:

mysql> truncate table orders;
Query OK, 0 rows affected (0.08 sec)

mysql> desc orders;
+--------------+-------------+------+-----+---------+----------------+
| Field        | Type        | Null | Key | Default | Extra          |
+--------------+-------------+------+-----+---------+----------------+
| order_id     | int         | NO   | PRI | NULL    | auto_increment |
| customer_id  | varchar(5)  | NO   | MUL | NULL    |                |
| product_id   | varchar(10) | NO   | MUL | NULL    |                |
| quantity     | int         | NO   |     | NULL    |                |
| total_price  | double      | NO   |     | NULL    |                |
| payment_mode | varchar(20) | NO   |     | NULL    |                |
| order_date   | date        | NO   |     | NULL    |                |
| order_status | varchar(20) | NO   |     | NULL    |                |
+--------------+-------------+------+-----+---------+----------------+
8 rows in set (0.00 sec)

mysql> insert into demo values('101');
Query OK, 1 row affected (0.01 sec)

mysql> desc demo;
+---------+-------------+------+-----+---------+-------+
| Field   | Type        | Null | Key | Default | Extra |
+---------+-------------+------+-----+---------+-------+
| demo_id | varchar(10) | NO   | PRI | NULL    |       |
+---------+-------------+------+-----+---------+-------+
1 row in set (0.00 sec)

Q) USING DROP COMMAND TO REMOVE TABLE/ROWS:

mysql> drop table demo;
Query OK, 0 rows affected (0.04 sec)

mysql> desc demo;
ERROR 1146 (42S02): Table 'ecommerce.demo' doesn't exist
mysql>